{
  "$schema": "https://json-schema.org/draft/2020-12/schema",
  "$id": "https://schemas.harness.invalid/config.common.schema.json",
  "title": "drogna common configuration sections",
  "description": "The sections every drogna component's configuration carries. A component schema does not reference this document's root; it references the entries under $defs, lists them among its own properties, and sets additionalProperties to false so that a typo in a key is a startup failure rather than a silent default. The root here validates a component that has no section of its own.",
  "type": "object",
  "required": ["component", "clock", "seed", "logging"],
  "additionalProperties": false,
  "properties": {
    "component": { "$ref": "#/$defs/component" },
    "clock": { "$ref": "#/$defs/clock" },
    "seed": { "$ref": "#/$defs/seed" },
    "broker": { "$ref": "#/$defs/broker" },
    "logging": { "$ref": "#/$defs/logging" }
  },
  "$defs": {
    "component": {
      "title": "Component identity",
      "description": "Who this process is. The id is deterministic and appears in heartbeats, in the clock's participant registry and in the run manifest.",
      "type": "object",
      "required": ["id"],
      "additionalProperties": false,
      "properties": {
        "id": {
          "type": "string",
          "pattern": "^[a-z][a-z0-9_-]*$",
          "description": "Stable component id, for example clock or env_generator."
        },
        "description": {
          "type": "string",
          "description": "One line for a human reading a heartbeat."
        },
        "heartbeat_interval_ticks": {
          "type": "integer",
          "minimum": 1,
          "description": "Declared liveness interval, counted in simulation ticks rather than host seconds so that it scales with the rate."
        }
      }
    },
    "clock": {
      "title": "Clock port configuration",
      "description": "Where the simulation clock service is and how this component reads it. The routes are configuration rather than code because they are part of the clock's published interface and because Constitution IV admits no URL or path literal in component source.",
      "type": "object",
      "required": ["endpoint", "routes", "mode"],
      "additionalProperties": false,
      "properties": {
        "endpoint": {
          "type": "string",
          "format": "uri",
          "description": "Base URL of the clock service (C-01)."
        },
        "routes": {
          "type": "object",
          "required": ["snapshot", "stream", "control"],
          "additionalProperties": false,
          "description": "Routes relative to the endpoint. Read and control routes sit under distinct prefixes so the reverse proxy can apply policy by prefix without enumerating routes.",
          "properties": {
            "snapshot": { "type": "string", "description": "Clock state snapshot, read." },
            "stream": { "type": "string", "description": "Tick stream, server-sent events, read." },
            "control": { "type": "string", "description": "Mode, rate, registration and acknowledgement, control." }
          }
        },
        "mode": {
          "$ref": "#/$defs/clock_mode",
          "description": "The mode this component expects the run to be in. It does not set the mode; the clock does."
        },
        "stale_after_gap": {
          "type": "integer",
          "minimum": 0,
          "description": "Tolerated gap in tick indices before the clock port reports itself stale. Gaps are normal in accelerated mode, so this is a per-component tolerance, not a constant."
        },
        "timeout_seconds": {
          "type": "number",
          "exclusiveMinimum": 0,
          "description": "Socket timeout for clock requests. A transport parameter, not a source of time."
        },
        "participant": {
          "type": "object",
          "required": ["id", "role"],
          "additionalProperties": false,
          "description": "Present when this component registers with the clock. Absent means it only listens.",
          "properties": {
            "id": {
              "type": "string",
              "pattern": "^[a-z][a-z0-9_-]*$",
              "description": "Deterministic participant id, recorded in the run manifest."
            },
            "role": { "$ref": "#/$defs/participant_role" }
          }
        }
      }
    },
    "seed": {
      "title": "Randomness configuration",
      "description": "The run's root seed and this component's stream prefix. Every generator in the process derives from these through harness_core.rng.",
      "type": "object",
      "required": ["root", "stream"],
      "additionalProperties": false,
      "properties": {
        "root": {
          "type": "integer",
          "minimum": 0,
          "description": "The run's root seed, recorded in the run manifest."
        },
        "stream": {
          "type": "string",
          "pattern": "^[a-z][a-z0-9_-]*$",
          "description": "This component's stream prefix. Stream names are <component>.<purpose>."
        }
      }
    },
    "broker": {
      "title": "Broker connection",
      "description": "MQTT connection details. Topics are namespaced obs/ and ctl/; the namespaces are conventions of the harness and are not configurable.",
      "type": "object",
      "required": ["url", "client_id"],
      "additionalProperties": false,
      "properties": {
        "url": { "type": "string", "format": "uri", "description": "Broker URL." },
        "client_id": {
          "type": "string",
          "pattern": "^[a-z][a-z0-9_-]*$",
          "description": "Deterministic client id. Never derived from entropy or from a host clock."
        },
        "keepalive_seconds": {
          "type": "integer",
          "exclusiveMinimum": 0,
          "description": "Transport keepalive. A socket parameter, not simulation time."
        }
      }
    },
    "logging": {
      "title": "Logging",
      "type": "object",
      "required": ["level"],
      "additionalProperties": false,
      "properties": {
        "level": {
          "type": "string",
          "enum": ["DEBUG", "INFO", "WARNING", "ERROR", "CRITICAL"],
          "description": "Log level. Log line decoration may carry host time; nothing else may."
        }
      }
    },
    "clock_mode": {
      "type": "string",
      "enum": ["realtime", "accelerated", "paused", "lockstep"],
      "description": "realtime and accelerated are free-running; paused emits nothing; lockstep advances only when every registered participant has acknowledged the current tick."
    },
    "participant_role": {
      "type": "string",
      "enum": ["observer", "lockstep"],
      "description": "An observer reads ticks. A lockstep participant additionally acknowledges each one, and the clock will not advance without it."
    }
  }
}
