{
  "component": {
    "id": "common",
    "description": "Values every component at this destination shares. A component's own file overrides what it needs to."
  },
  "clock": {
    "endpoint": "http://clock:8090",
    "routes": {
      "snapshot": "/clock/snapshot",
      "stream": "/clock/stream",
      "control": "/clock/control"
    },
    "mode": "accelerated",
    "stale_after_gap": 8,
    "timeout_seconds": 10.0
  },
  "seed": {
    "root": 20260826,
    "stream": "common"
  },
  "broker": {
    "url": "mqtt://broker:1883",
    "client_id": "common",
    "keepalive_seconds": 30
  },
  "logging": {
    "level": "WARNING"
  }
}
